{"schema_version":"0.3","id":"lose","world":{"capacity":1},"camera":{"position":[0,0],"half_extent":[16,9]},"grids":[],"spawn_groups":[],"systems":[],"rules":[],"ui":[{"id":"title","kind":"text","position":[480,300],"size":[800,100],"text":"GAME OVER  SCORE: {score}","font":"font","color":[1,0.4,0.45,1],"layer":1000,"text_scale":3},{"id":"restart","kind":"text","position":[480,410],"size":[700,60],"text":"SPACE TO RESTART","font":"font","color":[1,1,1,1],"layer":1000,"text_scale":2}]}
