{"schema_version":"0.3","id":"win","world":{"capacity":1},"camera":{"position":[0,0],"half_extent":[16,9]},"grids":[],"spawn_groups":[],"systems":[],"rules":[],"ui":[{"id":"title","kind":"text","position":[480,300],"size":[800,100],"text":"COLLECTION COMPLETE!","font":"font","color":[0.4,1,0.6,1],"layer":1000,"text_scale":3},{"id":"restart","kind":"text","position":[480,410],"size":[700,60],"text":"SPACE TO RESTART","font":"font","color":[1,1,1,1],"layer":1000,"text_scale":2}]}
